outcome,interpretation
d2_rwin_2002_2016,"Change in Republican House win indicator/share, ADHM public data"
d2_cfavg_repcon_2002_2016,"Change in conservative Republican candidate/legislator CF-score share, ADHM public data"
d2_cfavg_repmod_2002_2016,"Change in moderate Republican CF-score share, ADHM public data"
d2_cfavg_demmod_2002_2016,"Change in moderate Democratic CF-score share, ADHM public data"
d2_cfavg_demlib_2002_2016,"Change in liberal Democratic CF-score share, ADHM public data"
d2_teaparty_2002_2010,"Change in Tea Party outcome, ADHM public data"
d_shnr_pres_2000_2016,"Change in Republican presidential vote share, 2000-2016, ADHM public data"
d_shnr_pres_2000_2008,"Change in Republican presidential vote share, 2000-2008, ADHM public data"
